Sheet: Bus controller
A1: Bus controller registers
A3: The registers convey the following information:
A4: Status of each device slot (connected or not)
A5: Device descriptors
A9: Offset | B9: Register name | C9: Size (bytes)
A10: 0 | B10: Slot status register | C10: 4
A11: of:=[.A10]+[.C10] -> 4 | B11: Slot 0 device descriptor | C11: 12
A12: of:=[.A11]+[.C11] -> 16 | B12: Slot 1 device descriptor | C12: 12
A13: of:=[.A12]+[.C12] -> 28 | B13: Slot 2 device descriptor | C13: 12
A14: of:=[.A13]+[.C13] -> 40 | B14: Slot 3 device descriptor | C14: 12
A15: of:=[.A14]+[.C14] -> 52 | B15: Slot 4 device descriptor | C15: 12
A16: of:=[.A15]+[.C15] -> 64 | B16: Slot 5 device descriptor | C16: 12
A17: of:=[.A16]+[.C16] -> 76 | B17: Slot 6 device descriptor | C17: 12
A18: of:=[.A17]+[.C17] -> 88 | B18: Slot 7 device descriptor | C18: 12
A19: of:=[.A18]+[.C18] -> 100 | B19: Slot 8 device descriptor | C19: 12 | AU19: R/W
A20: of:=[.A19]+[.C19] -> 112 | B20: Slot 9 device descriptor | C20: 12 | AU20: RO
A21: of:=[.A20]+[.C20] -> 124 | B21: Slot 10 device descriptor | C21: 12
A22: of:=[.A21]+[.C21] -> 136 | B22: Slot 11 device descriptor | C22: 12
A23: of:=[.A22]+[.C22] -> 148 | B23: Slot 12 device descriptor | C23: 12
A24: of:=[.A23]+[.C23] -> 160 | B24: Slot 13 device descriptor | C24: 12
A25: of:=[.A24]+[.C24] -> 172 | B25: Slot 14 device descriptor | C25: 12
A26: of:=[.A25]+[.C25] -> 184 | B26: Slot 15 device descriptor | C26: 12
A27: of:=[.A26]+[.C26] -> 196 | B27: Slot 16 device descriptor | C27: 12
A28: of:=[.A27]+[.C27] -> 208 | B28: Slot 17 device descriptor | C28: 12
A29: of:=[.A28]+[.C28] -> 220 | B29: Slot 18 device descriptor | C29: 12
A30: of:=[.A29]+[.C29] -> 232 | B30: Slot 19 device descriptor | C30: 12
A31: of:=[.A30]+[.C30] -> 244 | B31: Slot 20 device descriptor | C31: 12
A32: of:=[.A31]+[.C31] -> 256 | B32: Slot 21 device descriptor | C32: 12
A33: of:=[.A32]+[.C32] -> 268 | B33: Slot 22 device descriptor | C33: 12
A34: of:=[.A33]+[.C33] -> 280 | B34: Slot 23 device descriptor | C34: 12
A35: of:=[.A34]+[.C34] -> 292 | B35: Slot 24 device descriptor | C35: 12
A36: of:=[.A35]+[.C35] -> 304 | B36: Slot 25 device descriptor | C36: 12
A37: of:=[.A36]+[.C36] -> 316 | B37: Slot 26 device descriptor | C37: 12
A38: of:=[.A37]+[.C37] -> 328 | B38: Slot 27 device descriptor | C38: 12
A39: of:=[.A38]+[.C38] -> 340 | B39: Slot 28 device descriptor | C39: 12
A40: of:=[.A39]+[.C39] -> 352 | B40: Slot 29 device descriptor | C40: 12
A41: of:=[.A40]+[.C40] -> 364 | B41: Slot 30 device descriptor | C41: 12
A42: of:=[.A41]+[.C41] -> 376 | B42: Slot 31 device descriptor | C42: 12
A44: Slot status register (4 byte)
A45: Offset | B45: Name | C45: Size | D45: 31 | E45: 30 | F45: 29 | G45: 28 | H45: 27 | I45: 26 | J45: 25 | K45: 24 | L45: 23 | M45: 22 | N45: 21 | O45: 20 | P45: 19 | Q45: 18 | R45: 17 | S45: 16 | T45: 15 | U45: 14 | V45: 13 | W45: 12 | X45: 11 | Y45: 10 | Z45: 9 | AA45: 8 | AB45: 7 | AC45: 6 | AD45: 5 | AE45: 4 | AF45: 3 | AG45: 2 | AH45: 1 | AI45: 0
A46: 0 | B46: Slot status register | C46: 4 bytes | D46: S31 | E46: S30 | F46: S29 | G46: S28 | H46: S27 | I46: S26 | J46: S25 | K46: S24 | L46: S23 | M46: S22 | N46: S21 | O46: S20 | P46: S19 | Q46: S18 | R46: S17 | S46: S16 | T46: S15 | U46: S14 | V46: S13 | W46: S12 | X46: S11 | Y46: S10 | Z46: S9 | AA46: S8 | AB46: S7 | AC46: S6 | AD46: S5 | AE46: S4 | AF46: S3 | AG46: S2 | AH46: S1 | AI46: S0
A47: Name | B47: Description | E47: R/W
A48: Sx | B48: Set if a device is registered at slot X | E48: RO
A50: Slot X device descriptor register (12 bytes)
A51: Offset | B51: Name | C51: Size | D51: 31 | E51: 30 | F51: 29 | G51: 28 | H51: 27 | I51: 26 | J51: 25 | K51: 24 | L51: 23 | M51: 22 | N51: 21 | O51: 20 | P51: 19 | Q51: 18 | R51: 17 | S51: 16 | T51: 15 | U51: 14 | V51: 13 | W51: 12 | X51: 11 | Y51: 10 | Z51: 9 | AA51: 8 | AB51: 7 | AC51: 6 | AD51: 5 | AE51: 4 | AF51: 3 | AG51: 2 | AH51: 1 | AI51: 0
A52: X*12 + 4 | B52: Mapped region start | C52: 4 bytes | D52: START
A53: X*12 + 8 | B53: Mapped region end (exclusive) | C53: 4 bytes | D53: END
A54: X*12 + 12 | B54: IRQ line and device class | C54: 4 bytes | D54: reserved | T54: CLASS | AB54: IRQ
A55: Name | B55: Description | M55: R/W
A56: START | B56: Address of the first byte of the memory-mapped region assigned to the connected device | M56: RO
A57: END | B57: Address of the last byte + 1 of the memory-mapped region | M57: RO
A58: CLASS | B58: Connected device class | M58: RO | AU58: R/W
A59: IRQ | B59: IRQ line assigned to the device | M59: RO | AU59: RO
AU60: RO
AU61: RO